Link,Job Title,Company,Days since Post,Location,Job Description,Salary
https://sg.indeed.com/rc/clk?jk=4bca0d58e3ca6b92&bb=8yYejGzSlqWt7w7fffPSzxfbELxe5S3IqfBzMeIg6zqVd9fhhEHNFUEJBPUHIIVqei8dKsjv2EhQ85FH41orJrWF22G74c5puBfIRXXHCC1avN55H8mWrg%3D%3D&xkcb=SoB967M365cLhQTI250NbzkdCdPP&fccid=c1099851e9794854&vjs=3,"iPhone PR Manager, Southeast Asia",Micron,1,Singapore,"Summary

Posted: 2 Oct 2024

Weekly Hours: 40

Role Number:200567661

Apple's communications team shapes and shares with the world the stories about our innovative products and services, and the values that drive everything we do. The team includes professionals with backgrounds in public relations, journalism, social media, writing and buzz marketing. We’re looking for trailblazing, creative and collaborative professionals from a variety of fields. If that’s you, then your next home may be here. Come and do the best and most exciting work of your career at Apple! We’re looking for trailblazing, collaborative professionals from a variety of creative fields. Inclusion is a shared responsibility and we work together to foster a culture where everyone belongs and is inspired to do their best work. Come and do the best and most exciting work of your career at Apple! This role will join the Product PR team and report into SEA Senior PR Manager, to help create and implement PR initiatives for Apple's iPhone and Apple Intelligence business with an emphasis on social-first campaigns. We are looking for candidates that possess strong PR and communications skills, along with a consistent track record driving PR results across consumer technology and consumer lifestyle. Ideal profiles are passionate about cultivating new relationships with media and creators, and skilled at developing unique narratives and storylines that resonate with online audiences.

Description

The successful candidate will bring energy, ideas and an appetite to bring fresh storytelling ideas to fruition. This person will be responsible for iPhone as a camera for the world’s most innovative photographers, as a mobile edit suite film makers using software like iMovie, for social content creators on TikTok and Instagram, or for citizen journalists in urban centres. They will have more than an ear to the ground: they will be immersed in an iPhone-enabled culture of photographers, producers, content creators, influencers and media to support all Southeast Asia markets while directly managing Singapore and Malaysia. This person will also be responsible for proactive and reactive communications for Apple’s Artificial Intelligence and Machine Learning (AI/ML) work, which includes Siri, new Apple Intelligence features across all Apple products and services, and other projects. - This role will work in partnership with the senior manager to create strategies and deliver campaigns that increase awareness and understanding of products and their software across Southeast Asia. - The successful candidate will work collaboratively with a variety of other teams and functions to create and deliver the activity that increases awareness and understanding. This may include other product PR managers covering iPad, Mac and Services, country product PR teams in Thailand, Vietnam and Indonesia, Product Marketing and Marcom teams. - You will help us find new relationships amongst the talent and communities that use our products to deliver the world’s most exciting work, and will be tasked with leading our efforts in finding new media and social platforms through which we can tell those stories. - This role will involve travel upto 30%.
BS/BA or equivalent experience preferred
8+ years experience in public relations, influencer relations or PR agency in Southeast Asia.


Preferred Qualifications
Effectively builds formal and informal relationship networks inside and outside the organisation.
Develops and delivers effective communications that convey a clear understanding of the unique needs of different audiences.
Analyses complex, high quantity, and sometimes contradictory information to effectively solve problems.
Understands internal and external stakeholder requirements, expectations, and needs.
Understanding of smartphone market an advantage.
Experience in media relations and developing a network of media contacts in creative, tech, photography, artificial intelligence, design and cultural platforms
Successfully delivered creative PR campaigns that have created meaningful impact
Self-motivated, possess a positive team-player attitude and passionate about consumer technology. Self-starter who is dedicated and demonstrates creative and critical thinking abilities
Able to work with ambiguity and on complex topics across multiple jurisdictions
Able to influence and gain alignment from others in sensitive situations-without damage to the relationship.
Excellent written and verbal communications skills.
Fluency in English - ability to write, converse and understand a second South Asian language an advantage.
Apple is an equal opportunity employer that is committed to inclusion and diversity. We take affirmative action to ensure equal opportunity for all applicants without regard to race, color, religion, sex, sexual orientation, gender identity, national origin, disability, Veteran status, or other legally protected characteristics",No salary information provided
https://sg.indeed.com/rc/clk?jk=ffe093452847d3ce&bb=8yYejGzSlqWt7w7fffPSzwyT6nofvHKursjd9UsYOVtgm8Lk4TgA-qWSpONJU0WVB2pNP2CmRRjQIQOBacPbsIY4DuRJYCLPQYql0m8UvhGEp-9o9sfsig%3D%3D&xkcb=SoDJ67M365cLhQTI250MbzkdCdPP&fccid=86d4b5da3ae0fbfe&vjs=3,Product Manager - Ad Tech Products,Micron,1,Singapore,"Employment Type: Full-Time
Location: Singapore
Minimum Experience: 3-5 years

Pixalate is an online trust and safety platform that protects businesses, consumers, and children from deceptive, fraudulent, and non-compliant mobile, CTV apps, and websites.
Our software and data have been used to unearth multiple high-profile criminal and illegal surveillance cases including:
Gizmodo: An iCloud Feature Is Enabling a $65 Million Scam, New Research Says
Adweek: A 7-Figure Ad Fraud Scheme Running on Roku Underlines Murkiness of CTV
Washington Post: Your kids’ apps are spying on them
Pro Publica: Porn, Piracy, Fraud: What Lurks Inside Google’s Black Box Ad Empire
ABC7 News: The State of Children's Privacy Online
NBC News: How many apps are tracking your children
Our team of lawyers, data scientists, engineers, economists, and researchers span globally with a presence in California, New York, Washington DC, London, and Singapore.

RESPONSIBILITIES
Be the Fraud Prevention product Suite “GM”
EXTREMELY Analytical and data driven
Experience dealing with vast amounts of data
Draw conclusions and product features by finding global correlations and patterns in our data
Work closely with the data science team on implementing new fraud detection and prevention algorithms
Work with Product Operations team to plan and release regular product updates
Drive documentation, launches, GTM plan, positioning and messaging for the product
Build, maintain, prioritize and communicate product roadmap/strategy for both internal and external stakeholders
Work with product marketing team on messaging and value proposition
Work with media journalists and industry analysts on product briefings and analyst reports
Support Sales and Business Development in presenting product road map and demoing new features to current and prospective clients
Represent the company on industry panels and in cross company working groups and initiatives such as IAB, MRC and TAG

QUALIFICATIONS
Expertise and Deep Knowledge within Online Fraud in its many forms (I.e. Advertising Fraud, Payment Fraud, Botnets, Phishing Attacks, etc.)
Minimum 5+ years developing widely adopted B2B SaaS Enterprise Products with Fraud Detection and Prevention, Malware, or Threat Intelligence capabilities
Very comfortable with SQL and querying data warehouses
Solid understanding of fundamental computer networking concepts and technologies (e.g. IP stack, HTTP, IP addressing (V4/V6), DNS, Web Proxies, etc)
Solid understanding of the mobile ecosystem and its challenges for fraud detection
Expertise in latest market trends in Enterprise Security, i.e. knowledge of best practices of Enterprise Security Detection, Knowledge of some historic Cyber Security Events/Attacks (what went wrong, how could the Enterprise have prevented this), and What will be best practices for the future
Bachelors or Masters in Computer Science, Computer Engineering or Software Engineering (or any other relevant engineering degree or Engineering Experience)
Understanding of botnet architectures, exploit kits, malware
A ‘do-whatever-it takes attitude to accomplish what needs to be done, which may include Travel on short notice, Travel to Clients, and to our LA HQ.
BENEFITS

We focus on doing things differently and challenge each other to be the best we can be.Monthly internet reimbursement
Casual work environment
Flexible hours
Opportunity for advancement
Fun annual team events
Being part of a high performing team that wants to win and have fun doing it
Extremely competitive compensation

2BWvq2ZOD3",No salary information provided
https://sg.indeed.com/rc/clk?jk=7634930d67146e29&bb=8yYejGzSlqWt7w7fffPSz2BOIc9nGiLeAGCEJFmjckRSoPnpAIS9s9-VfdnOs-rYSuCTBWZNIGQ488P6Kr8g9R-GNjt5Tw-pjHt6j5q5VP4wViGv98b-g1op2pL59-CV&xkcb=SoAg67M365cLhQTI250DbzkdCdPP&fccid=5f1c372a0ae86589&vjs=3,Director of People & Culture,Micron,1,Singapore,"Company Description

Finmo is the next-generation Treasury Operating System (TOS) for global companies built on real-time payments (RTP) rails. Finmo lets you collect money, make payments, manage
cash and liquidity, mitigate financial risks, and comply with financial regulations – all in one place.
Our mission is to simplify payments, automate mission-critical treasury functions, and empower businesses and consumers to transact with the most relevant methods that optimize speed, convenience, and cost.
Finmo is built on the foundation of real-time payments rails and facilitates instant money transfers, accurate cash flow forecasting, optimized liquidity management, effective financial risk mitigation, and seamless compliance with financial regulations – in one place.
By consolidating these essential functions into one category-defining product, Finmo sets a new standard for how financial technology platforms can support your financial stability and ensure continued success beyond mere fund transfers.
Founded in 2021, Finmo Tech is headquartered in Singapore and has offices in Australia, India and further expansion on the horizon. Finmo Tech is venture backed (Global Founders Capital, Addition Ventures) and founded by a team of payment professionals with 2 decades of experience in building global payments infrastructure and companies.

Job Description

As Director of People and Culture, you will spearhead the development and execution of HR strategies that support the scaling of our global organisation. You'll lead the charge in crafting policies and procedures that ensure fairness, consistency, and compliance across all regions. This role requires a strategic thinker able to engage effectively with diverse teams and stakeholders.
Key Responsibilities
Lead and develop HR strategies and practices for a globally scaling organisation.
Develop and govern HR policies, procedures and guidelines, promoting consistency and fairness in their application - ensuring all local legislation is adhered to.
Lead a team of specialists for day to day HR services and further develop an effective business partnership model that meets internal stakeholder expectations.
Promote professional development of the organisation by developing performance management strategies and training.
Encourage and strengthen organisational culture by collaborating with internal managers and advocating for good people practices to take place.
Support leaders and people managers across the organisation to effectively manage their team - provide effective solutions for leadership development.
Develop workforce management strategies that help structure teams and help align with business objectives.
Oversee and develop programs that enhance employee skills, career growth and leadership development.

Qualifications

Proven experience in leading HR functions in a dynamic, fast-paced global environment.
Strong leadership skills and the ability to develop high-performing teams.
Excellent communication skills to effectively connect with all levels of the organisation and its international offices.
A strategic mind with a hands-on approach to HR management.
Experience in nurturing a motivational workplace culture that upholds the company’s values and mission.
Experience in working hands-on with other cross-functional team leaders, such as compliance team, product managers, data analysts, operations analysts in improving all HR processes for the organisation.
Possess a “get-things-done” mindset and demonstrate a strong work ethic as well as a high degree of integrity.
Methodical and systematic work approach with excellent time management, and possess a continuous improvement mindset.

Additional Information

Benefits
Competitive compensation package.
Paid Annual leave along with other statutory leaves.",No salary information provided
https://sg.indeed.com/rc/clk?jk=9602be22bdf6d1fb&bb=8yYejGzSlqWt7w7fffPSz4BFta1FU_926-G9Pa6z9qVf0KAFYQVgwyeSqUi8g-J83NzvFmV3onWY-WLPH89IFf3chSviBDMxbCQ6ujHPD1-Gk_W_C5jW5yPUj5iVjQ-q&xkcb=SoCU67M365cLhQTI250CbzkdCdPP&fccid=216eb700022de6f6&vjs=3,Machine Learning Engineer - Intern,Micron,1,Singapore,"Machine Learning Engineer - Intern
This role has been designed as ‘’Onsite’ with an expectation that you will primarily work from an HPE office.
Who We Are:
Hewlett Packard Enterprise is the global edge-to-cloud company advancing the way people live and work. We help companies connect, protect, analyze, and act on their data and applications wherever they live, from edge to cloud, so they can turn insights into outcomes at the speed required to thrive in today’s complex world. Our culture thrives on finding new and better ways to accelerate what’s next. We know diverse backgrounds are valued and succeed here. We have the flexibility to manage our work and personal needs. We make bold moves, together, and are a force for good. If you are looking to stretch and grow your career our culture will embrace you. Open up opportunities with HPE.
Job Description:

Responsibility :
Design, develop, and implement machine learning models and algorithms to solve complex business problems.
Collaborate with cross-functional teams, including data scientists, software engineers, and product managers, to integrate ML solutions into products.
Preprocess and analyze large datasets to extract meaningful insights and prepare data for modeling.
Optimize and fine-tune machine learning models to enhance performance, accuracy, and efficiency.
Conduct experiments and evaluate various machine learning techniques to identify the best approaches for specific use cases.
Develop and maintain scalable ML pipelines and infrastructure for deploying models in production environments.
Stay updated with the latest advancements in machine learning, artificial intelligence, and related technologies.
Write clear, maintainable code and create comprehensive documentation for ML models and processes.
Monitor and troubleshoot deployed models, ensuring they perform as expected in real-world settings.
Communicate findings, progress, and results to stakeholders through reports, presentations, and visualizations.
Education and Experience Required:
Enrolled in University.
Knowledge about Machine Learning, Deep Leaning and Gen AI
Additional Skills:
Accountability, Accountability, Action Planning, Active Learning (Inactive), Active Listening, Bias, Business, Calendar Management, Coaching, Computer Literacy, Creativity, Critical Thinking, Design Thinking, Empathy, Follow-Through, Group Problem Solving, Growth Mindset, Intellectual Curiosity (Inactive), Long Term Planning, Managing Ambiguity, Office Administration, Policy and procedures, Recordkeeping, Risk Assessment, Service And Support Planning {+ 6 more}
What We Can Offer You:
Health & Wellbeing
We strive to provide our team members and their loved ones with a comprehensive suite of benefits that supports their physical, financial and emotional wellbeing.
Personal & Professional Development
We also invest in your career because the better you are, the better we all are. We have specific programs catered to helping you reach any career goals you have — whether you want to become a knowledge expert in your field or apply your skills to another division.
Diversity, Inclusion & Belonging
We are unconditionally inclusive in the way we work and celebrate individual uniqueness. We know diverse backgrounds are valued and succeed here. We have the flexibility to manage our work and personal needs. We make bold moves, together, and are a force for good.
Let's Stay Connected:
Follow @HPECareers on Instagram to see the latest on people, culture and tech at HPE.
Job:
Administration
Job Level:
N/A

HPE is an Equal Employment Opportunity/ Veterans/Disabled/LGBT and Affirmative Action employer. We are committed to diversity and building a team that represents a variety of backgrounds, perspectives, and skills. We do not discriminate and all decisions we make are made on the basis of qualifications, merit, and business need. Our goal is to be one global diverse team that is representative of our customers, in an inclusive environment where we can continue to innovate and grow together. Please click here: Equal Employment Opportunity.
Hewlett Packard Enterprise is EEO F/M/Protected Veteran/ Individual with Disabilities.

HPE will comply with all applicable laws related to employer use of arrest and conviction records, including laws requiring employers to consider for employment qualified applicants with criminal histories.",No salary information provided
https://sg.indeed.com/rc/clk?jk=6279d349cf2b74e7&bb=z19gs5XdyYcHpL1BixZSdjLtCuCO455XEa_U_ltDgSmBmJ7xqnPL2dQJZchiChE_RtURU28kbHLi5-i_cC62sXhD7HsbBfHt5Gas4Tr1_540JL_3KwggpSsyjr9oGfDC&xkcb=SoCZ67M365cLTQSxlJ0KbzkdCdPP&fccid=3d17815c82ef2ab3&vjs=3,Customer Success Manager,Micron,1,Singapore,"Make Your Mark
Cymulate's Continuous Security Validation enables companies to challenge, assess and optimize their cyber-security posture against the evolving cyberthreat landscape, simply and continuously.
With world-class clients like YMCA, Brinks, and EuroNext we strive to bring the highest level of service to everything we do. Our team is made up of the very best people for the job and as we grow, we're always on the lookout for people with the skills, experience, and personality that will let us both shine. With high scores on Gartner and Glassdoor, our clients and employees have let us know what they love about us.
What you will do:
Serve as the primary contact liaison for technical questions or escalations, collaborating with Support, Product Management, and other relevant teams.
Help customers develop success plans, outlining critical goals and key performance indicators, and provide guidance in achieving these objectives. Measure customers' achievement of these key performance indicators and report those both internally and externally.
Collaborate with Cymulate Account management teams to secure contract renewals.
Assist in identifying opportunities for expanding Cymulate's usage across the customer's organization.
Lead POCs for upsells and participate in pilot results presentations, QBR's and ABR's with key accounts.
What you will have:
3-5 years of experience in customer success/ project management role with a proven track record of success, particularly in managing major accounts.
Technical experience in the cybersecurity field with good analytical and project management skills.
Proactive approach to problem solving with the ability to make independent decisions.
Identify problems and address them internally to drive resolution with tech support team.
Proven track record of building and maintaining relationships with enterprise clients, driving customer success, and exceeding performance targets.
Excellent communication and interpersonal skills, with the ability to effectively engage with stakeholders at all levels of an organization.
Ability to multi-task and thrive in a fast-paced environment.
Fluency in English.",No salary information provided
https://sg.indeed.com/rc/clk?jk=09d696bfb9579872&bb=z19gs5XdyYcHpL1BixZSdgs-s6vooBdQnq8QLT8DsXpolUPiS1jH8XmMLKWbgeCiHQsZ1jlhX-ouEX9-XD7zbosReaezIgVJIsHTutXpbtOibxudN3lsc8ApvXLNgipM&xkcb=SoAt67M365cLTQSxlJ0LbzkdCdPP&fccid=35969c42c598d44d&vjs=3,Nutritionist,Micron,1,Singapore,"Nutritionist is expected to have high level of diet knowledge, training and motivational skills. Knowledge to design a diet chart for the clients online, monitor it and ensure that clients get adequate online support and motivation to execute their food habitual program to get results. Able to work in a highly professional and performance oriented environment.
Key Responsibilities:
Monitoring dietary intake of the clients for smooth functioning of their program.
Advise diet according to their requirement considering their eating habits, likes and dislikes and life style.
Evaluating strengths and weaknesses of clients, considering their medical conditions, recording the progression through program stages, and recommending/implementing protocol or program changes as required.
Managing group coaching on chat groups by motivating clients towards fitness.
Skills Needed:
Tech and Internet savvy.
Deep understanding of clinical nutrition.
Good teamwork/interpersonal and excellent skills.
A postgraduate qualification in nutrition with a special course in diabetes/sports nutrition with relevant work experience will be advantageous.",No salary information provided
https://sg.indeed.com/rc/clk?jk=2efcd0cdcf8f13bf&bb=BBU1u9Z7NvTrsFjxVjXkyXE-nozxURdrYv3RDWDFCvSdoPVVdbBDkwb2oHg5WQ7n7lAtvUV6-UMFW-ysq-aL6U558uEAr3MSAYr8vETJHPBJBb60HSGSuxzjo2ZBs7fs&xkcb=SoCq67M365cLXnyL7h0FbzkdCdPP&fccid=3376355cceaae707&vjs=3,Frontend Developer (REACT),Micron,1,Singapore,"Zenith Infotech (S) is a Tech Recruitment firm with 27 years of presence in Singapore, supporting government and corporate clients in terms of ICT Consultant placements.

Currently,, we are assisting one of our cients to lookout for Frontend Developer (REACT JS) on a 12 months contract, renewable.

Responsibilities:
Person in this role shall be responsible for building and maintaining scalable web applications using React and TypeScript, with a focus on UI components built with Material-UI (MUI).

The developer will manage state with Recoil or Redux, integrate complex forms with React JSONSchema Forms, and ensure high code quality through Jest tests and adherence to coding standards like ESLint and Prettier.

They will collaborate with cross-functional teams, communicate effectively with clients, and ensure on-time delivery of tasks. Strong client-facing skills are essential, as is the ability to present work and solutions clearly.

The developer will also integrate APIs using Axios, optimize application performance, and ensure accessibility standards using tools like axe DevTools. They should be adept at using Git and following GitFlow for version control, and setting up development environments with Node.js and Yarn.

Key traits include a proactive, problem-solving attitude, attention to detail, and a commitment to continuous learning. They will maintain documentation using Storybook and contribute to team success by ensuring deliverables meet client expectations on time.

Top 3 Mandatory Skills
1. React
2. TypeScript
3. Material-UI (MUI)

Skills which are good to have
1. Recoil or Redux
2. Jest and React Testing Library
3. Storybook
4. Axios
5. GitFlow workflow",No salary information provided
https://sg.indeed.com/rc/clk?jk=3758f4500f7c7065&bb=BBU1u9Z7NvTrsFjxVjXkySJ0EE9Q5OOUxBnDKIag0iGcYbSa_CGUAd1r_Mf531q6ZIAz99sNJvgj6muICwQd_xZr2KUrtORU9poIPG2GIOP4nBnE5vwnjSp9tCg36Fx0&xkcb=SoA367M365cLXnyL7h0GbzkdCdPP&fccid=eea53e2acff39e00&vjs=3,Project Assistant and Driver,Micron,1,Singapore,"1.Project Planing( One of the first tasks of a construction manager is to plan the scope, schedule, and cost of a construction project.)
2.Project Management( A construction manager is responsible for managing the day-to-day operations of a construction site.)
3.Project Coordination( A construction manager acts as a liaison between the different parties involved in a construction project.)
4.Project Completion( A construction manager ensures that the project is completed on time, within budget, and according to the specifications.)
5.Skill and Quolification( To become a construction manager, you need to have a combination of education, experience, and skills.)
6.Pick up and drop off workers to and form works.( Need have driver's license)",No salary information provided
