Link,Job Title,Company,Days since Post,Location,Job Description,Salary
https://sg.indeed.com/rc/clk?jk=c20051bd44c76192&bb=IayyimarFxqJWnUb1PrtkK1eqjkqwLAEHundRmh29nS1e_UUNf3sXWF72ZjcAJ2bSSH1RAI0kwy24oYDmk95eYzxsbS4XL7UGdBpZE9o20FnNMatH8_2By2NZAyqToim&xkcb=SoBr67M365cLfMSxlJ0FbzkdCdPP&fccid=a88b8a0fd9c24f34&vjs=3,Digital Enablement Analyst,Micron,1,Singapore,"Prudential’s purpose is to be partners for every life and protectors for every future. Our purpose encourages everything we do by creating a culture in which diversity is celebrated and inclusion assured, for our people, customers, and partners. We provide a platform for our people to do their best work and make an impact to the business, and we support our people’s career ambitions. We pledge to make Prudential a place where you can Connect, Grow, and Succeed.
Join us in the midst of a rapid and exciting transformation! We are driving a customer-centric strategy, adopting new technologies, revamping our digital platforms, and building new digital capabilities.

The Distribution Digital Enablement team is at the forefront of our digital agenda. We design innovative solutions, solve complex problems, prioritize backlogs, and develop a clear roadmap for future digital initiatives.

As part of this dynamic team, you will support the Digital Transformation Lead in transforming our financial planning and point of sales platform. You will drive the ideation, development and iteration of product features, and play a crucial role in stakeholder management and change management to ensure maximum adoption of new capabilities and platforms across our channels.
Support Digital Transformation Lead in implementing new platforms and capabilities, as well
as maintaining current distribution platforms
Collaborate closely with Engineers, Business Analysts, Tech Product Owners, and other
stakeholders to ensure effective communication, understanding of business requirements,
and prioritization of the backlog
Facilitate requirement discussions and review user stories to ensure business requirements
are accurately captured
Oversee delivery quality by working closely with Technology and Quality Assurance teams
during UAT reviews and sign-offs, ensuring operational readiness for each release.
Document and prioritise identified defects, working closely with the development team to
ensure timely resolution
Support in preparing training materials and communications for new launches / releases to
ensure business readiness and drive adoption
Monitor project progress, provide updates, and escalate risks and issues as needed, following
up on actionable items and mitigations.
Who we are looking for:
Prior experience in digital transformation project management and execution related roles in
the financial / insurance sector preferred
Excellent analytical and problem-solving skills
Strong communication and documentation skills
Good working experience in Ms Office Suite, JIRA and Confluence
Customer centric
Innovative and collaborative mindset
Hands-on and accountable § Practical and fast learner in a fast-paced environment
Working Experience:
At least 2-3 years of experience in digital transformation project management and execution related roles in the financial / insurance sector preferred
Education:
Degree in any discipline
Language:
Strong command of the English language
Work Format:
Hybrid

Prudential is an equal opportunity employer. We provide equality of opportunity of benefits for all who apply and who perform work for our organisation irrespective of sex, race, age, ethnic origin, educational, social and cultural background, marital status, pregnancy and maternity, religion or belief, disability or part-time / fixed-term work, or any other status protected by applicable law. We encourage the same standards from our recruitment and third-party suppliers taking into account the context of grade, job and location. We also allow for reasonable adjustments to support people with individual physical or mental health requirements.",No salary information provided
https://sg.indeed.com/rc/clk?jk=6aa1cd3aabdea1e9&bb=Z8FsXlDUiH52Nl0gCUo2bGZRg-S-QouAerBJ5Bv67vJTjeBXM_L-QnbbFm1jjqlULK-d1hdY9VuEG2e8GNkrDPc7v7fcbARUNfcKTA_Ze6iELMS7cGCg9KafYghYswQO&xkcb=SoB767M365cLZlTI250LbzkdCdPP&fccid=6dbbacc42ce83058&vjs=3,CSV Engineer (Pharma/Biotech),Micron,1,Singapore,"This role is responsible for handling mainly DeltaV and BAS changes due to tech transfer, upgrades, and routine change, able to independently handle the validation of the mini projects so relevant experience is required.
Responsibilities:
Manage Computer System Validation Lifecycle from design to execution phases, Including relevant CSV documentations such as Configuration specification, design review, commissioning documents, and protocols.
Responsible for preparation of CSV documents and protocols, perform execution for automated equipment and/or control systems, and closure of executed protocols.
Work largely requires use of valgenesis software to create validation documents and electronic test case execution
Work with SME to generate test cases and CSV documents.
Provide guidance on test case execution and exception handling.
Support SME on documentation matters and ensure documents are completed in time.
Any other task as assigned by Supervisor/Manager.
About You:
Bachelor of Science/Engineering or higher in a scientific or engineering discipline
Min 2 – 3 years of in validation (preferred equipment or CS validation)
Understand validation principles and keen interest in CSV and
Willing to learn and able to work with not much supervision
Demonstrated proficiency of written and verbal communication skills with ability to communicate and collaborate effectively with cross-functional teams
Must be team player, curious with strong analytical and organizational skills
Based in Tuas.
1 year contract. Option to extend/annual renewal depending on performance",No salary information provided
https://sg.indeed.com/rc/clk?jk=0d27f4fd591dbaeb&bb=h65qdgZQh7BFxzVYPsmuXO9wny4zwhtAffjI1BcZDQkOEvA5pevftgK_6h2VvFR-i8Mkul3-Ra3-fv4imKuvb4PcwyxD1J5ZvTQZGfasvizVuApU72aaOBAlMEsHND7y&xkcb=SoBt67M365cLCszI250MbzkdCdPP&fccid=1544766d4c2915b0&vjs=3,"ServiceNow Lead (Financial Services) Manager, Tech Consulting",Micron,1,Singapore,"At EY, you’ll have the chance to build a career as unique as you are, with the global scale, support, inclusive culture and technology to become the best version of you. And we’re counting on your unique voice and perspective to help EY become even better, too. Join us and build an exceptional experience for yourself, and a better working world for all.

We are the only professional services organisation who has a separate business dedicated exclusively to the financial services marketplace. Join Financial Services Consulting and you will work with multi-disciplinary teams from around the world to deliver a global perspective. Aligned to key industry groups including banking and capital markets, insurance and wealth & asset management, we provide integrated consulting, assurance, tax and transaction services.

The opportunity

EY’s consulting professionals bring a wealth of experience in working with major financial institutions to align their operating model and infrastructure to business strategy. We assemble the right multi-disciplinary teams, use consistent and proven global methodologies and tools, and draw on the full breadth of EY’s global network, to deliver value and trusted advice to the clients.

Our key service offerings cover business and technology strategy & transformation, customer and distribution effectiveness, operations, shared services / outsourcing support, performance management, program advisory, enterprise intelligence, risk management and regulatory change.

Your key responsibilities

Project Delivery: Oversee the end-to-end delivery of ServiceNow HR Service Delivery and workplace projects, ensuring that all aspects of the project are completed to the highest standard.
Requirements Gathering and Analysis: Conduct comprehensive requirements gathering sessions with HR stakeholders to understand both functional and technical needs. Analyze these requirements to develop clear and concise documentation for use by the development team.
Team Management: Act as the primary liaison between the onshore project team and the offshore development team. Manage and coordinate the offshore team's activities, ensuring adherence to project timelines and quality standards.
Process Optimization: Identify opportunities for process improvement within HR service delivery and recommend solutions that leverage ServiceNow capabilities to enhance efficiency and user experience.
Solution Design and Implementation: Collaborate with the solution architect and developers to design and implement ServiceNow HR Service Delivery modules that meet the project's functional and technical requirements.
Quality Assurance: Oversee the testing phase, including the creation of test plans, test cases, and coordination of user acceptance testing (UAT) to ensure that the developed solutions meet the specified requirements.
Communication and Reporting: Maintain clear and consistent communication with all project stakeholders, providing regular updates on project status, risks, and issues.
Vendor Management: Manage relationships with vendors and third-party service providers, ensuring that their contributions align with project goals and deliverables.
Training and Knowledge Transfer: Ensure that the HR team and end-users are well-trained on the new ServiceNow functionalities and that proper documentation is provided for ongoing support and maintenance.
Change Management: Lead change management efforts to ensure smooth adoption of the new ServiceNow HR Service Delivery solutions across the organization.

Skills and attributes for success

HR Service Delivery Expertise: In-depth knowledge of HR service delivery frameworks and the ability to leverage ServiceNow to enhance HR operations.
ServiceNow Proficiency: Advanced technical skills in ServiceNow platform configuration, customization, and integration. Familiarity with ServiceNow's HR Service Delivery module is essential.
Project Management: Proven ability to manage complex projects with multiple stakeholders, ensuring deliverables are achieved on time and within budget.
Analytical Thinking: Strong analytical and problem-solving skills, with the ability to understand detailed HR functional requirements and translate them into effective technical solutions.
Possess strong Interpersonal and Teaming skills: Exceptional team collaboration abilities, with experience working in cross-functional teams and fostering a cooperative work environment.
Technical Acumen: Leverage technology to continually learn, improve service delivery and maintain our leading-edge best practices.
Training and Development: Experience in developing and delivering training materials and sessions to ensure end-users are proficient in using the ServiceNow platform.
Presentation Skills: Strong presentation skills and proficiency in the use of PowerPoint, Word and Excel
Adaptability: Ability to adapt to changing priorities and maintain a flexible approach to managing workload.

To qualify for the role you must have
Minimum 6 years’ experience in the Financial Services industry, having worked with firms like asset managers, private banks or wealth managers, sovereign wealth funds, pension funds, private equity firms or hedge funds.
Strong understanding of HR processes and experience in automating HR services.
Academic background in Engineering, IT, Business, HR, Economics or Finance.
Consulting skills, functional and technical knowledge of ServiceNow and enterprise application delivery.
Excellent problem-solving skills and the ability to translate functional needs into technical solutions.
Track record dealing with senior stakeholders and adapting to demanding environments.
Ideally, you’ll also have
Experience in agile delivery methodologies, e.g. sprints, product backlogs, user stories.
Technical proficiency with ServiceNow, including experience with configuration, customization, and integration.
ServiceNow certifications (e.g., ServiceNow System Administrator, ServiceNow Implementation Specialist) are highly desirable.

What we look for

Highly motivated individuals with excellent problem-solving skills and the ability to prioritize shifting workloads in a rapidly changing industry. An effective communicator, you’ll be a confident team player that collaborates with people from various teams while looking to develop your career in a dynamic organization

What working at EY offers

We offer a competitive compensation package where you’ll be rewarded based on your performance and recognized for the value you bring to our business. We also offer you:

Continuous learning: You’ll develop the mindset and skills to navigate whatever comes next.
Success as defined by you: We’ll provide the tools and flexibility, so you can make a meaningful impact, your way.
Transformative leadership: We’ll give you the insights, coaching and confidence to be the leader the world needs.
Diverse and inclusive culture: You’ll be embraced for who you are and empowered to use your voice to help others find theirs.

If you can confidently demonstrate that you meet the criteria above, please contact us as soon as possible.

Join us in building a better working world.

Apply now.

EY | Building a better working world

EY exists to build a better working world, helping to create long-term value for clients, people and society and build trust in the capital markets.

Enabled by data and technology, diverse EY teams in over 150 countries provide trust through assurance and help clients grow, transform and operate.

Working across assurance, consulting, law, strategy, tax and transactions, EY teams ask better questions to find new answers for the complex issues facing our world today.",No salary information provided
https://sg.indeed.com/rc/clk?jk=fac28293fab48f55&bb=h65qdgZQh7BFxzVYPsmuXICL4RNKqdmKi5smCzdydvEyfgnc8StLRYy4w_D17epnxPjQN4SlVFP1GydMwVEt1PgGFVQ7R4Oi63eQriG-mhx2Rjtm1_HXIxpITSELk44E&xkcb=SoDZ67M365cLCszI250NbzkdCdPP&fccid=dd616958bd9ddc12&vjs=3,Accounts Administrator,Micron,1,Singapore,"About Kaia
Kaia is a public blockchain platform developed by Kakao, a major South Korean tech company, aimed at simplifying blockchain adoption for enterprises and developers. Designed for high performance and scalability, Kaia combines the benefits of public blockchains, like decentralization and transparency, with private blockchains’ reliability and low latency. It supports smart contracts, DeFi, NFTs, and offers a user-friendly development environment, making it popular across various industries in Asia. Kaia’s unique consensus mechanism, IBFT (Istanbul BFT), ensures quick, secure transactions, appealing to businesses needing efficient and scalable blockchain solutions.

Job Description
Perform accounting and general administrative tasks:-
Maintain proper filing of accounting documents and records
Handle general expense bookkeeping and adjust entries as needed
Manage the accounting-related system to ensure accurate and timely financial reporting
Extract and organize requested accounting data to meet reporting needs
Manage bank accounts and necessary administrative works
Draft and Manage the board resolution/meeting/agreement
Perform other general administrative tasks (e.g. liaising with banks or other vendors for KYC matters when required)
Assist in preparing withholding tax (ad-hoc basis; generally 1 or 2 times per year) and retrieving invoices
Handle accounts payable-related matters
Review and prepare payments for company expenses, including staff claims and corporate card expenses
Record and maintain payment lists in the accounting system.
Manage contracts/invoices
Audit support
Provide support during the external audit process
Requirements:
Knows basic accounting (debit, credit).
Diploma in accountancy or business administration
Responsible and meticulous
proficient in Microsoft Excel

Note: This position is open for full-time (office/remote/hybrid)",No salary information provided
https://sg.indeed.com/rc/clk?jk=fc5eac48b31aae93&bb=h65qdgZQh7BFxzVYPsmuXO9wny4zwhtAX_pYynk8x7-AByqeszacKlCXPRt9kjVGwNDU1jxw5kMAcQGH0vZgIK4DOFhJ9-9rXmhxI0dBk4VYutUE3KPxhQqPhNC-zrdt&xkcb=SoBE67M365cLCszI250ObzkdCdPP&fccid=9212c2d101f68e3a&vjs=3,HR Manager ( E-Commerce),Micron,1,Singapore,"Atomic is collaborating with a rapidly growing e-commerce company that is expanding its operations.
The ideal candidate will support the full scope of Human Resources responsibilities and partner with the organization on strategic initiatives. They will maintain and enhance the organization's human resources by planning, implementing, and evaluating human resources policies, programs, and practices.

There will be a focus on recruitment of Tech Talents, Prior Payroll experience is required.
Budget: $6500/month
Location: East Area of Singapore

Job Description
Recruitment and Talent Acquisition:
Develop and implement recruitment strategies to attract top talent.
Manage the full recruitment cycle, from job posting to interviewing and onboarding.
Employee Relations:
Act as a point of contact for employee inquiries and concerns.
Mediate conflicts and facilitate resolution to maintain a positive work environment.
Performance Management:
Oversee performance appraisal processes and provide guidance to managers.
Implement training and development programs to enhance employee skills.
Processing of Payroll :
Oversee the end-to-end payroll process, ensuring accuracy and compliance with federal, state, and local regulations..
Compensation and Benefits:
Manage payroll, benefits administration, and employee compensation programs.
Conduct salary benchmarking and provide recommendations for compensation adjustments.
Job Requirement
Bachelor’s degree in Human Resources, Business Administration, or a related field; Master’s degree or HR certification preferred.
Proven experience as an HR Manager or similar role (typically 5+ years).
Strong knowledge of HR practices, employment law, and regulatory compliance.
Excellent communication and interpersonal skills.
Proficient in HR software and Microsoft Office Suite.
Strong analytical and problem-solving abilities.
Interest parties, please apply this role directly or email your resume on word copy to Pierre.Lim@atomicgroup.sg
EA Licence: 23S1885
Personnel Registration Number: R1548471",No salary information provided
https://sg.indeed.com/rc/clk?jk=a92e073fc7b3bed9&bb=h65qdgZQh7BFxzVYPsmuXFfKC63YVYg4u0fo9t_dx0EZUScrwg5ASnfvzXfYiEXGpP7sf68cf5NAG6FfBZZ7-OUqF5fl54rv72YyFRa0A2jckTrawPAQtP1hFWFnSXHj&xkcb=SoDw67M365cLCszI250PbzkdCdPP&fccid=2452c8db6b9fe32f&vjs=3,CNC MACHINIST,Micron,1,Singapore,"Job Qualifications:
Able to read machining Drawing
Able to do Programming and Setting CNC Milling or Turning (Fanuc,Hurco)
. Able to operate physically on CNC 3-axis / 2-axis), Milling machine or Turning machines
Responsible, Positive Attitude and able to work well as a team
Able to work in Tuas area
Able to start work immediately
Job Responsibilities:
Perform CNC Milling 3 Axis / machine operating and Turning machines operating
To do Inspection production parts
Maintain good 5S standards
Maintain good safety and health standards
Salary: $3,500.00 - $5,000.00 per month
Experience:
machinist: 3 – 4 years",No salary information provided
https://sg.indeed.com/rc/clk?jk=6213882ade0f33e9&bb=h65qdgZQh7BFxzVYPsmuXNoCVevLD7qiJUE9NDuvePRVLai3Xio-mIcz6prIaZfYkuGW_vhMTyinx3uUBdQoNCd8TXTRVbRGO4X8bQKjDwZLobgsO7EshgadNcfiSYy6&xkcb=SoB-67M365cLCszI250IbzkdCdPP&fccid=a17a0e8185af75d3&vjs=3,stage manager,Micron,1,Singapore,"Job Title: Stage Manager

Key Responsibilities
Production Leadership: Oversee all stages of production from initial planning to final performance, ensuring all elements align with the creative and technical vision.
Act as the main point of contact for directors, designers, and department heads, coordinating effectively to maintain artistic integrity and operational efficiency.

Crew Management: Direct and manage the backstage crew, assigning roles, overseeing cue execution, and ensuring adherence to safety standards.
Lead technical rehearsals, manage performance cues, and support cast and crew to achieve peak performance.

Technical Proficiency: Collaborate closely with lighting, sound, and set design teams to coordinate timing and technical elements with precision.
Leverage extensive knowledge of theater technology, including stage equipment, lighting, and sound systems, to anticipate and address technical challenges in real-time.

Communication & Scheduling: Develop and manage detailed rehearsal and performance schedules, making necessary adjustments for production needs.
Ensure timely and clear communication across departments through call sheets, rehearsal notes, and performance reports.

Crisis & Contingency Management: Prepare for potential issues and establish contingency plans to handle unexpected challenges swiftly and effectively.
Implement and enforce safety protocols, maintaining a secure environment for all cast and crew members.

Key Requirements:
Professional Experience: Minimum of 5 years as a Stage Manager in professional theater, concerts, or large-scale events.
Technical Skills: In-depth understanding of stage equipment, lighting and sound systems, cue management, and tech troubleshooting.
Leadership: Demonstrated ability to lead, motivate, and organize crew and performers with a calm, composed demeanor.
Adaptability: Proven experience in handling live performance challenges and maintaining focus under high-pressure situations.",No salary information provided
https://sg.indeed.com/rc/clk?jk=6864242338c732cd&bb=h65qdgZQh7BFxzVYPsmuXBd-3d_lt4Lr3Mluqm8Dz1amrAPnyAUhEiEa5RbHKUOOkIMFKiwRnR5UCsIlecwzbY8qnwAq6x89BhA-wwJDLeD-A1EmXCNey18ri32Hkmy1&xkcb=SoDK67M365cLCszI250JbzkdCdPP&fccid=d2b30c1fdfa442cb&vjs=3,Senior Recruitment Consultant,Micron,1,Singapore,"About Tech Grid Asia
Tech Grid Asia is an innovative IT software development company founded in Singapore that specializes in providing Digital Strategy Consulting and Technology Solutions services. Our team of professionals is experienced in creating and implementing custom software solutions to elevate your business to the next level.
In addition to our software development expertise, Tech Grid Asia also offers Technology Recruitment Consultancy services. We specialize in permanent, contract, staffing, and payroll solutions to help clients find the perfect fit for their organization.
We are currently expanding rapidly and looking for like-minded, driven people to join us!
Job Summary
In addition to being exposed to candidates and clients, you will be required to manage and ensure a successful and good process of a job seeking experience, developing relationships and developing recruiting methods, which are essential aspects of the job.
You will collaborate closely with the Team Leaders/Managers and learn the craft of hiring from them.
Responsibilities:
Doing the 360 degree practice of recruitment including attracting clients and candidates
Developing relationships, managing active communication with clients
Pre-screening candidate’s CV, assessing candidate’s potential interview and prepare to forward candidate’s profile to clients
Managing the end to end process from coordinating with client to candidate’s start date
Developing and maintaining relations with HR team/Recruit channel partners
Always keeping in contact with clients to get feedback of candidates
Focused, self-motivated and a confident individual who possesses strong customer service, sales experience and multi-tasking skills
Achieves sales target
Preparing wage schedules, employment conditions, compensation and benefits for employment approval
Requirements:
Great negotiation skills
Good command of English
Passionate in a sales-driven / target driven working environment
Sociable, outgoing and hustler personality, enjoy meeting new people on a daily basis
Eager and passionate in a recruitment consultancy environment where you will always learn new and different things from time to time
Minimum 3 years of relevant experience in a past recruitment consultancy role
Why Join Us ?:
Competitive compensation package
Comfortable and conducive working environment
Attractive Paid Leave Package with additional Birthday & Anniversary Leave
Professional Development Opportunities
Career Progression",No salary information provided
