Link,Job Title,Company,Days since Post,Location,Job Description,Salary
https://sg.indeed.com/rc/clk?jk=82c455bd25c6fb52&bb=Z8FsXlDUiH52Nl0gCUo2bA4MC5cqAH3szSeIMcbD7TxRwd5PZkYnF0NBADCon3-WR41xTQco69hG1w_usOVY6mWx6NTUPH8ywWPFaaypNLxl_WSB3yw06XSpvVNKRwK7&xkcb=SoBo67M365cLZlTI250PbzkdCdPP&fccid=7c138e549c2cd781&vjs=3,"Director, One-Time Services, APAC",Micron,1,Singapore,"At Braze, we have found our people. We're a genuinely approachable, exceptionally kind, and intensely passionate crew.
We seek to ignite that passion by setting high standards, championing teamwork, and creating work-life harmony as we collectively navigate rapid growth on a global scale while striving for greater equity and opportunity – inside and outside our organization.
To flourish here, you must be prepared to set a high bar for yourself and those around you. There is always a way to contribute: Acting with autonomy, having accountability and being open to new perspectives are essential to our continued success. Our deep curiosity to learn and our eagerness to share diverse passions with others gives us balance and injects a one-of-a-kind vibrancy into our culture.
If you are driven to solve exhilarating challenges and have a bias toward action in the face of change, you will be empowered to make a real impact here, with a sharp and passionate team at your back. If Braze sounds like a place where you can thrive, we can't wait to meet you.
Braze's One-Time Services (OTS) division is committed to empowering our customers and partners during the early phase of our customers journey with Braze and at further crucial points in their lifecycle as their technical and business requirements evolve and grow.
Our goal is to facilitate the smooth activation of entitlements, accelerate the customer's time-to-value, and ensure an outstanding customer experience by delivering world-class professional services, challenging the status quo, and creating tailored solutions for business needs and outcomes. We create long-term partnerships with our customers that are built on trust. We've got a talented team of experts dedicated to help customers get the most value out of Braze.
We champion collaboration and a growth mindset to propel Braze's continuous evolution and the development of our people from both a skill and career perspective.
WHAT YOU'LL DO
Be a core member of the One-Time Services Department Senior Leadership Team, helping guide and shape the future of the department and contributing to the future of the wider business
Manage multiple One-Time Services teams in APAC and act as the direct manager of both people managers and individual contributors across multiple diverse locations - hiring, nurturing, performance managing, and supporting the development and satisfaction of your team
As required, hire and nurture new talent into our world-class One-Time Services organization by building a pipeline of candidates, setting clear expectations, and managing performance
Develop an efficient organization that maintains our high standard of excellence when providing support to customers
Gather and use insight to drive regional and global improvements to service offerings, processes, and ways of working
Work with Senior Director / VP of One-Time Services to develop short-term (yearly) territory staffing model based on revenue, partner revenue, and team utilization targets and monitor and address any shifts on an ongoing basis; own P&L for your region
Responsible for team performance, health, and employee engagement KPI achievement in the region - regularly review regional team KPIs and make adjustments to process and personnel based on business need
Advocate customer business use cases and feedback to product development
Responsible for setting and delivering regional Objectives and Key Results (OKRs)
Work closely with internal cross-departmental stakeholders to design and develop efficient processes and working practices to ensure alignment and excellent customer experience
Monitor regional book of business to identify risks and opportunities, taking action, and providing guidance and participating in escalation management
Own a strategic pillar or process for Global One-Time Services and/or sponsor Global initiatives
WHO YOU ARE
10+ years relevant professional experience in a related area for example, Customer Onboarding, Consultancy, Account Management or Mobile Marketing
3+ years experience managing and mentoring people managers and individual contributors
Significant project management experience and/or formal certifications (PMP, PMgP, Agile, Prince2 etc)
You have exemplary written and verbal communication skills coupled with unparalleled follow up skills
You build strong positive relationships with customers and colleagues
You are known for being a team player
You have a high level of intellectual curiosity
You see opportunity and growth in learning more and continuously improving both processes and yourself
You have strong technical domain knowledge of two or more of the following: Mobile Development, APIs, Marketing Automation, Direct Marketing, Analytics, or Programming (HTML etc.)
WHAT WE OFFER
Details of these benefits plan will be provided if a candidate receives an offer of employment. Benefits may vary by location.
From offering comprehensive benefits to fostering flexible environments, we've got you covered so you can prioritize work-life harmony.
Competitive compensation that may include equity
Retirement and Employee Stock Purchase Plans
Flexible paid time off
Comprehensive benefit plans covering medical, dental, vision, life, and disability
Family services that include fertility benefits and equal paid parental leave
Professional development supported by formal career pathing, learning platforms, and tuition reimbursement
Community engagement opportunities throughout the year, including an annual company wide Volunteer Week
Employee Resource Groups that provide supportive communities within Braze
Collaborative, transparent, and fun culture recognized as a Great Place to Work®
ABOUT BRAZE
Braze is a leading customer engagement platform that powers lasting connections between consumers and brands they love. Braze allows any marketer to collect and take action on any amount of data from any source, so they can creatively engage with customers in real time, across channels from one platform. From cross-channel messaging and journey orchestration to Al-powered experimentation and optimization, Braze enables companies to build and maintain absolutely engaging relationships with their customers that foster growth and loyalty.
Braze is proudly certified as a Great Place to Work® in the U.S., the UK and Singapore. We ranked #3 on Great Place to Work UK's 2024 Best Workplaces (Large), #3 on Great Place to Work UK's 2023 Best Workplaces for Wellbeing (Medium), #4 on Great Place to Work's 2023 Best Workplaces in Europe (Medium), #10 on Great Place to Work UK's 2023 Best Workplaces for Women (Large), #19 on Fortune's 2023 Best Workplaces in New York (Large). We were also featured in Built In's 2024 Best Places to Work, U.S. News Best Technology Companies to Work For, and Great Place to Work UK's 2023 Best Workplaces in Tech.
You'll find many of us at headquarters in New York City or around the world in Austin, Berlin, Chicago, Jakarta, London, Paris, San Francisco, Singapore, Sydney and Tokyo – not to mention our employees in nearly 50 remote locations.
BRAZE IS AN EQUAL OPPORTUNITY EMPLOYER
At Braze, we strive to create equitable growth and opportunities inside and outside the organization.
Building meaningful connections is at the heart of everything we do, and that includes our recruiting practices. We're committed to offering all candidates a fair, accessible, and inclusive experience – regardless of age, color, disability, gender identity, marital status, maternity, national origin, pregnancy, race, religion, sex, sexual orientation, or status as a protected veteran. When applying and interviewing with Braze, we want you to feel comfortable showcasing what makes you you.
We know that sometimes different circumstances can lead talented people to hesitate to apply for a role unless they meet 100% of the criteria. If this sounds familiar, we encourage you to apply, as we'd love to meet you.
Please see our Candidate Privacy Policy for more information on how Braze processes your personal information during the recruitment process and, if applicable based on your location, how you can exercise any privacy rights.",No salary information provided
https://sg.indeed.com/rc/clk?jk=3262e77035c001a1&bb=Z8FsXlDUiH52Nl0gCUo2bCk4s-dg7YKDG1Uc7Kky5eGFQBG8RQ-JmRMjSdKk1amkpYcDrW4O7UJcnHACPYo8vmtVzo51ytVsdehN_RoUywOr1GPAWw3znVLrzu7AqLpq&xkcb=SoDm67M365cLZlTI250IbzkdCdPP&fccid=ac0d41f76394463b&vjs=3,ASSOCIATE DIRECTOR - DIGITAL,Micron,1,Singapore,"We’re looking for a Performance Marketing Director to join our award-winning integrated digital consultancy. You will be in charge of leading amplification performance-led projects, developing optimisation protocols and execution, driving strategy development and marketing implementation to meet client's business objectives.

You will oversee amplification campaign strategy development, planning, implementation, execution and tracking across Google ensuite Ads (GDN, YT, SEM), with secondary priorities around SEO, Social. There will be opportunities for CRM workflows and email marketing work, and KPIs are around maximisation of marketing and advertising ROI for clients. You will oversee and manage ad budgets for campaigns, plan and conduct optimisation with A/B testing, while working with cross-functional teams of researchers, copywriters and designers.

The ideal candidate is independent, proactive, highly collaborative, with strong problem solving and analytical skills, and a self-starter. You are a strategic thinker, and are comfortable understanding and leveraging audience insights and data to help drive toward marketing and sales goals, creating business impact for clients.

//
Responsibilities

Marketing Strategy and Execution
Design and set comprehensive goals for performance and meeting of client's business objectives
Set up marketing campaigns across channels including media planning, buying and channel optimisation
Oversee strategic implementations and interpret campaign metrics and develop data-driven approaches toward achieving client's objectives
Develop, implement, and manage all aspects of PPC ad planning and buying, paid social media, including strategy, target analysis, ad setup, content calendar, monitoring, and reporting
Plan, develop, and defend budget recommendations, work goals, campaign strategies
Proactively monitor, track and report on campaign metrics and performance
Anticipating trends that may influence our work in relation to client's businesses
Conduct competitive analyses or other business research to develop relevant insights to inform marketing strategy
Fluent in the workings, language and lexicon of various disciplines helming our business i.e. creative, content, digital strategy, martech and branding
Identify and consult growth resulting in additional business opportunities for clients and assist in executing strategies against those opportunities when necessary

REQUIREMENTS
Possess at least a Marketing or Data Degree
At least 15 years of working experience in marketing, with prior agency or consultancy experience preferred, hands-on in digital media and account management capacities
Fluency across marketing strategies, understanding of the customer funnel and ability to optimise conversions at various stages
Fluency with SaaS tools for web / SEO / paid analytics such as GA, SEMRush and Socialbakers
Fluency with performance KPIs: CPA, CPC, CPI, CPM, Attribution and LTV
Knowledge of online advertising platforms and analytics tools for online channels
Knowledge across mar-tech infrastructure architecture
Knowledge with creation and running of email workflows and campaigns across Hubspot, Mailchimp, Drip, etc
Excellent verbal and written communication skills, with the ability to present well externally on behalf of the team in a consultative, client-facing environment
Strong listening, questioning, and critical-thinking skills
Ability to work collaboratively in a cross-functional team
Confident, independent, and proactive with a can-do attitude
Self-motivated and driven with hunger to learn and stay abreast of marketing and digital industry trends
Strong strategic, implementation and organisation skills, attention to detail
Ability to effectively manage multiple projects smoothly and thoroughly, while adopting a self-directed attitude to achieve results

About AKIN / Why Join Us:
AKIN designs marketing strategies for a restless digital generation. Positioned at the intersection of data, creative design and contemporary culture, our unique approach to marketing delivers real business impact. We help brands articulate their purpose through a deep understanding of consumer and cultural truths. We design impactful marketing campaigns based on data and analysis. We build smart solutions and websites that bring you closer to your audiences. Above all, we’re interested in helping your brand nurture consumer relationships that will stand the test of time.",No salary information provided
https://sg.indeed.com/rc/clk?jk=2cf48bbf3f98639e&bb=Z8FsXlDUiH52Nl0gCUo2bJFZlsMn6jHhe_3IAg__BhXMwwH4ARkTBjPv0vv5X2zVkiA0qgUgizCowtswwn0FiYg2bf0aMBeVt2775NY5KDace1oaV503C9dz0RCmxBA0&xkcb=SoBS67M365cLZlTI250JbzkdCdPP&fccid=3376355cceaae707&vjs=3,Application Tech Support Practitioner (IT Operation) | Contract,Micron,1,Singapore,"The Hypervisor, Storage, and Backup Lead is responsible for managing, maintaining, and optimizing the client’s virtual infrastructure, storage systems, and data backup solutions.

Key Responsibilities
1. Hypervisor Management:
a. Design, implement, and maintain virtual infrastructure using hypervisor technologies such as VMware or Oracle Linux Virtualization Manager (OLVM).
b. Monitor and optimize virtual machine performance, resource allocation, and utilization.
c. Ensure high availability and reliability of the virtual infrastructure through proactive maintenance and monitoring.
d. Manage and resolve incidents and problems related to the virtual environment.

2. Storage Management:
a. Oversee the administration of storage systems, such as SAN and NAS.
b. Perform regular storage health/utilization checks and recommend optimization.
c. Ensure sufficient capacity for application/infrastructure needs across storage systems.
d. Manage and resolve incidents and problems related to the storage systems.

3. Backup Management:
a. Manage backup solution for client’s environment.
b. Monitor backup schedules, ensuring successful completion and addressing any failures.
c. Ensure compliance with data retention policies and regulations.
d. Manage and resolve incidents and problems related to the backup solution.

4. Documentation and Reporting:
a. Maintain documentation of virtual environments, storage configurations, and backup procedures.
b. Generate regular reports on system performance, capacity planning, and backup status.
c. Prepare Root Cause Analysis report for high severity incidents.
d. Escalate to vendor when necessary for incident resolution.
Our key requirement is the candidate had prior experience to operate (not limited to managing team/solution architect) at minimum the following:
1. Hypervisor – VMware & Oracle VM
2. Storage – HPE Storage (3Par) and SAN Switches
3. Backup – Veritas NetBackup

This is an operations role, the candidate is expected to be working on shift hours.",No salary information provided
https://sg.indeed.com/rc/clk?jk=ed4d0e8f015312b9&bb=Z8FsXlDUiH52Nl0gCUo2bIMfGSewud7XZw4XWQJyYItSceHlS7nG-dhyKelITfIkc0MeSaRkO2_d2hDmbxlyoHNgE844E52nLKeU6AAC0NZ9cuChL2cRmOg2xZSa_Xc_&xkcb=SoDP67M365cLZlTI250KbzkdCdPP&fccid=2df17de4242fed73&vjs=3,PIPE FITTER CUM WELDER,Micron,1,Singapore,"Min. 3 to 4 years’ experience in Welding & fitting
Able to read construction drawings and work independently
Workers who having welder certification of 3G/4G/6G
Stainless steel piping welding
Shielded Metal Arc Welding
ARC, TIG & MIG welding
Gas Cutting & Grinding
Lays out, positions, aligns, and fits components together.
Bolts, clamps, and tack-welds parts to secure in position for welding.
May assemble parts by bolting and riveting.",No salary information provided
https://sg.indeed.com/rc/clk?jk=758a7067b53360e3&bb=Z8FsXlDUiH52Nl0gCUo2bE5iOxs_AB3s0G5M1XcV9pavGfR1I_-gXgncjKga2IjVb3sJFxhf0Ge8fQ_j8PBcHLJu-82W3i7piCWk8aRCLhzDR8cQgNvXWhjxOF6RrD5q&xkcb=SoCB67M365cLZlTI250AbzkdCdPP&fccid=1d346661f0bfbf0e&cmp=The-Story-Behind&ti=Content+Writer&vjs=3,Content Creator / Videographer,Micron,1,Singapore,"About Us:
The Story Behind is a dynamic video production company specializing in creating a diverse range of content, including corporate videos, event videos, social media content, and variety programs such as ""Outcasts."" Our mission is to infuse unconventional, fresh, experiential, fun, and entertaining elements into our creative solutions.
Job Overview:
We are seeking an experienced and knowledgeable Gaffer to join our Filming Tech Crew. The ideal candidate will have a strong background in lighting for film and video production, with the ability to design and implement effective lighting setups that enhance the visual quality of our projects. You will collaborate closely with the Director of Photography and other crew members to achieve the desired lighting effects and maintain high production standards.
Key Responsibilities:
Lighting Design: Develop and execute lighting plans that align with the creative vision and technical requirements of each project.
Setup and Operation: Set up, operate, and maintain lighting equipment, including lights, dimmers, and lighting control systems.
Collaboration: Work closely with the Director of Photography, camera operators, and other crew members to ensure cohesive and effective lighting setups.
Troubleshooting: Identify and resolve lighting issues on set, ensuring smooth and efficient production workflows.
Safety Compliance: Ensure all lighting setups comply with safety regulations and best practices.
Equipment Management: Oversee the maintenance and inventory of lighting equipment, ensuring all gear is in good working condition.
Innovation: Stay current with the latest lighting technologies and techniques to bring innovative solutions to our productions.
Requirements:
Education: A diploma or degree in Film Production, Cinematography, or a related field is preferred.
Experience: Minimum of 3 years of experience as a Gaffer or in a similar lighting role in film or video production.
Skills:
Proficiency in using various lighting equipment and technologies.
Strong understanding of lighting principles and techniques.
Ability to interpret lighting plans and execute complex lighting setups.
Excellent problem-solving skills and attention to detail.
Strong communication and teamwork abilities.
Physical ability to handle and set up heavy lighting equipment.
Attributes:
Creative and adaptable with a strong aesthetic sense.
Passionate about film production and visual storytelling.
Ability to work under pressure and meet tight deadlines.
Job Types: Full-time, Permanent
Pay: $2,800.00 - $3,500.00 per month
Schedule:
Monday to Friday
Work Location: In person",No salary information provided
https://sg.indeed.com/rc/clk?jk=023f95ad1f7a8f3d&bb=h65qdgZQh7BFxzVYPsmuXJjMjMC_2bwXMTR6HK51obPTJYi1V41lzbxt2pM-xI6aWtGKgWc0TGMc-vU7r7RRIjrBOzAChhWWCXkjBEC3-Cpt4WQ1vaGUTS-JBnTFkfc5&xkcb=SoCE67M365cLCszI250DbzkdCdPP&fccid=71045bbc9978c395&vjs=3,IT Project Executive,Micron,1,Singapore,"Join Our Team at Appvantage in Singapore!
Are you ready for an exhilarating new journey with us?
At Appvantage, we're not just a team; we're a passionate community of digital strategists, designers, and developers. Our expertise shines through as we tackle major digital projects for global corporations across the Asia & Pacific region, particularly in the automotive industry.
Why Appvantage?
We are proud to be recognized as a leading workplace in the technology sector. Appvantage has received accolades and has been named on the prestigious ""Singapore Best Workplaces™ in Technology List"". This ""Great Place to Work"" certification is a collective achievement that we are all proud of, as it reflects our shared commitment to creating a supportive, empowering, and inclusive work environment. Join us and be part of a dynamic team dedicated to innovation and excellence.
As we continue to expand and drive innovation, we are seeking a dynamic and experienced IT Project Executive to join our team in Singapore.
Job Description
Here's a glimpse of your responsibilities:
Cultivate Connections: Foster strong relationships with clients, vendors, and partners while ensuring that project implementations meet our stringent quality standards.
Project Support: Collaborate with Project Directors, Senior Project Managers, or Project Managers in various aspects of project management, including:
Crafting proposals and quotations, and skillfully negotiating with clients
Managing project implementation plans and budgets.
Defining project deliverables at each milestone.
Vigilantly monitoring progress and taking proactive measures when needed.
Manage the project implementation plan & budget; identify the scope of project deliverables at each project milestone; monitor progress & take preventive/corrective action whenever necessary.
Requirements Elicitation : Partner with clients to identify high-level requirements and capture critical business needs. You'll excel at articulating and documenting these requirements, assessing solution risks, and prioritizing effectively.
Quality Assurance: Oversee QA/QC activities to ensure successful and timely project delivery, aligning precisely with client expectations.
Documentation Guru: Prepare a variety of project documentation, including Minutes of Meeting, Requirement Specifications, Design Specifications (or Understanding Documents), Training and User Manuals, Release Notes, and Project Status Reports. Clearly articulate and document business requirements. Assess the risks of various solutions and prioritize competing business demands.
Versatile Contributor: Take on additional duties and responsibilities as assigned.
Job Requirements
Educational Background: Bachelor’s Degree in Information Systems or Business.
Experience : 1-2 years' experience in the IT industry is preferred.
Communication: Excellent communication skills are essential.
Tech-Adept: Proficiency in Microsoft Office (Excel, Word, PowerPoint).
Attitude: You're organized, meticulous, and always approach tasks with a positive attitude.
Project Acumen: Strong administrative skills and a general understanding of the project life cycle, project documentation, and project standards.
Methodologies: Prior experience with SCRUM/Agile methodologies is a plus.
Join us at Appvantage, where every day brings exciting challenges and opportunities for growth. If you're ready to make your mark in the dynamic world of digital innovation, we invite you to embark on this journey with us. Your adventure starts here!",No salary information provided
